id,created_at,text
961654081495420928,2018-02-08 17:32:54,b'RT @KTNNews: Manwa Hosea: The first question we need to ask is how did that obituary get into the newspaper? The rigorous process that goes\xe2\x80\xa6'
961653361178284032,2018-02-08 17:30:02,b'Tourism industry earnings grow to Sh120 billion in 2017 \nhttps://t.co/mz7Neu28BX https://t.co/FSHgaXBbol'
961652503577317377,2018-02-08 17:26:38,b'RT @KTNNews: Obituary AD farce: A comparision between facts laid out in the erroneous obituary and the real facts about Jimmy Wanjigi\n#TheB\xe2\x80\xa6'
961650405758439424,2018-02-08 17:18:17,"b'RT @KTNNews: ""If i am killed I will just be another statistic"" Jimmy Wanjigi responds to his own obituary that was erroneously published in\xe2\x80\xa6'"
961648320031666177,2018-02-08 17:10:00,b'This is how Peter Munya made MPs vetting him laugh\nhttps://t.co/nQ537HxPJ8 https://t.co/WaJCQiBIz8'
961647515388047361,2018-02-08 17:06:48,"b'Respect the rule of law, NASA supporters in London tell Jubilee government \nhttps://t.co/gAx9eA1TC3 https://t.co/jPTKtCa4PD'"
961645806859120640,2018-02-08 17:00:01,b'Family travel: Discovering the pleasant destinations in Kenya \nhttps://t.co/e4SsAW6hnm https://t.co/WBO8IvjexD'
961645220977922048,2018-02-08 16:57:41,b'RT @StandardKenya: This is Peter Munya\xe2\x80\x99s BOLD agenda for all East Africans if approved CS\nhttps://t.co/zrqO7N7zdy https://t.co/4R09z8BnaB'
961645193568059393,2018-02-08 16:57:35,b'RT @KTNNews: This is Peter Munya\xe2\x80\x99s BOLD agenda for all East Africans if approved CS\nhttps://t.co/kHkKMF5AdT https://t.co/UYQaJt0RPc'
961645174349860864,2018-02-08 16:57:30,b'RT @KTNKenya: This is Peter Munya\xe2\x80\x99s BOLD agenda for all East Africans if approved CS\nhttps://t.co/QkkZoD6KQJ https://t.co/P7zjvQtf6S'
961642029582237696,2018-02-08 16:45:00,b'This is Peter Munya\xe2\x80\x99s BOLD agenda for all East Africans if approved CS\nhttps://t.co/zrqO7N7zdy https://t.co/4R09z8BnaB'
961641149512474627,2018-02-08 16:41:31,b'Asante kwa kutazama taarifa za #KTNLeo na @Ali_Manzu kwa taarifa zaidi endelea kutazama @KTNNews\xe2\x80\xa6 https://t.co/Qo4DK9duEn'
961640472673423360,2018-02-08 16:38:49,b'RT @KTNNews: Mtazamaji pata hali ya hewa nchini Kenya\n#KTNLeo https://t.co/Yf1W3cb0ie'
961639248263811072,2018-02-08 16:33:57,"b'RT @KTNNews: Mfanyibiashara Jimmy Wanjigi amesisitiza kwamba tangazo la kifo liliochapishwa katika gazeti la Daily Nation hapo jana, likiwa\xe2\x80\xa6'"
961638252510724096,2018-02-08 16:30:00,"b'Citizen TV and Inooro TV back on air, 10 days after they were switched off \nhttps://t.co/BIgFjB78fm https://t.co/PfsQ6AQs2N'"
961636664203534338,2018-02-08 16:23:41,b'RT @KTNNews: Baadhi ya wale walioteuliwa kuhudumia katika nafasi mbali mbali katika baraza la mawaziri mapema hii leo walijitokeza katika u\xe2\x80\xa6'
961636438436667392,2018-02-08 16:22:47,"b'RT @KTNNews: Marufuku ya kuchoma makaa ambayo iliyotolewa na Gavana wa Kitui Charity Ngilu, imeonekana kuendelea kuzua utata katoka Kaunti\xe2\x80\xa6'"
961633397121667072,2018-02-08 16:10:42,b'Karibu kwenye taarifa za #KTNLeo hapa kwenye @KTNNews @KTNKenya na @Ali_Manzu\nTazama sasa kupitia ktnnews. https://t.co/qjs6ST2zNn'
961632107792564225,2018-02-08 16:05:35,"b""HUGE BLOW: Manchester United 'blame' Trump for losses... https://t.co/5dO6OXjBEd via @GameYetu https://t.co/aZXNklBDDy"""
961630710233624576,2018-02-08 16:00:02,b'Education Ministry de-registers two schools for failure to meet set standards \nhttps://t.co/4rwJuh5I3P https://t.co/f4B7EaEofy'
961629934857924608,2018-02-08 15:56:57,b'RT @StandardKenya: This is how Land CS nominee intends to make housing affordable to all Kenyans \nhttps://t.co/zGQuLCVnEk https://t.co/IsX1\xe2\x80\xa6'
961629901207023616,2018-02-08 15:56:49,b'RT @KTNNews: This is how Land CS nominee intends to make housing affordable to all Kenyans \nhttps://t.co/98bGP3F7zu https://t.co/mEZMt695NJ'
961629883708379136,2018-02-08 15:56:45,b'RT @KTNKenya: This is how Land CS nominee intends to make housing affordable to all Kenyans \nhttps://t.co/CPpFbnVTcy https://t.co/hqgO7bC79t'
961629271038025728,2018-02-08 15:54:19,b'This is how Land CS nominee intends to make housing affordable to all Kenyans \nhttps://t.co/zGQuLCVnEk https://t.co/IsX1ilUo4t'
961627724954701825,2018-02-08 15:48:10,"b'RT @KTNNews: Rahma Hersi, Mshirika ACL:\nWengi wanadhana kwamba msichana wa ngozi nyepesi atapata fursa zaidi ya kuposwa...\n@Ali_Manzu\n#Jukw\xe2\x80\xa6'"
961627084111138816,2018-02-08 15:45:37,"b'RT @KTNNews: Rahma Hersi, Mshirika ACL: Asilimia sabini ya vijana nchini Kenya hawajali jinsi wanavyotengeneza pesa kwao muhimu ni kuwa na\xe2\x80\xa6'"
961625671259885571,2018-02-08 15:40:00,b'Liverpool could spend more than 45 million euros to land the \xe2\x80\x9cMessi of goalkeepers\xe2\x80\x9d -via @UreportKe\xe2\x80\xa6 https://t.co/8RHDqwicPw'
961623159425286144,2018-02-08 15:30:01,b'Wanjigi seeking answers over false obituary \nhttps://t.co/JjgSnlcMqm https://t.co/rR2M7OdHPy'
961622893233926145,2018-02-08 15:28:58,"b'NRM\xe2\x80\x99s Miguna disputes claims that he was escorted to Amsterdam, vows to fight back \nhttps://t.co/nR66CDWhz8 https://t.co/t8hBLmLA2c'"
961620891774980096,2018-02-08 15:21:01,"b'RT @KTNNews: Mtazamaji leo katika swala nyeti tunazungumzia swala la ndoa, Je, talaka nyingi siku hizi husababishwa na nini?\nWasiliana nami\xe2\x80\xa6'"
961618121378287616,2018-02-08 15:10:00,"b'Join @Michellengele and @SophiaWanuna as we discuss: Jimmy Wanjigi, following the erroneous publication of his name\xe2\x80\xa6 https://t.co/y0H3hoFBNK'"
961615613402669056,2018-02-08 15:00:02,b'Kenya to host international conference on strengthening marriages \nhttps://t.co/wkjiCReGS8 https://t.co/cumz56ZsaR'
961612231472549888,2018-02-08 14:46:36,"b'RT @KTNNews: JE, UNADHANI TALAKA NYINGI  SIKU HIZI HUSABABISHWA NA NINI?\n@Ali_Manzu @KTNNews \n#JukwaaLaKTN'"
961611830094331906,2018-02-08 14:45:00,b'Lucky shoppers to get tickets for new movie featuring Lupita Nyongo \nhttps://t.co/ETt8S1WEtM https://t.co/DvJDmuokAI'
961610570150633476,2018-02-08 14:40:00,"b""Kenyans, including \xe2\x80\x98Slay queens\xe2\x80\x99, react to Paul Ogada's SportPesa Mega Jackpot win- via @UreportKe\xe2\x80\xa6 https://t.co/w0340KnHJJ"""
961608061545734144,2018-02-08 14:30:02,b'How to avoid being conned through International calls \nhttps://t.co/i3jIoNITZa https://t.co/vZs9Prj10D'
961605744356462592,2018-02-08 14:20:49,b'RT @KTNNews: Speaker Muturi\xe2\x80\x99s advice to Farida Karoney if approved to be Lands CS\nhttps://t.co/nBxigkfsOs https://t.co/0pJOmRdzet'
961605723099672577,2018-02-08 14:20:44,b'RT @KTNKenya: Speaker Muturi\xe2\x80\x99s advice to Farida Karoney if approved to be Lands CS\nhttps://t.co/9vojjqzSg8 https://t.co/14Gf2nZ6La'
961604881546084352,2018-02-08 14:17:24,b'Speaker Muturi\xe2\x80\x99s advice to Farida Karoney if approved to be Lands CS\nhttps://t.co/xMU1Ci8Eoe https://t.co/IFOYFfRQWB'
961604279349010432,2018-02-08 14:15:00,b'Retirement Authority approves CPF to roll-out sharia-compliant fund \nhttps://t.co/ijCuxH4UQd https://t.co/t0YP1lWaxQ'
961601810862571520,2018-02-08 14:05:12,b'UN agencies to fund projects in eight counties within arid and semi-arid areas \nhttps://t.co/T24JH3FgWz https://t.co/etctKboIPO'
961598832516714496,2018-02-08 13:53:21,b'CS nominee Karoney; this is how I\xe2\x80\x99ll solve historical land injustices in Kenya\nhttps://t.co/nZO5WjrpZs https://t.co/Sp7H6hPn0B'
961595471503347712,2018-02-08 13:40:00,"b'Financial experts advice Paul Ogada, SportPesa Mega Jackpot winner how he should spend his cash- via @UreportKe\xe2\x80\xa6 https://t.co/H1x05AMBVg'"
961592953671008257,2018-02-08 13:30:00,b'Do you know of any opportunities that have not been exploited in agribusiness? \nJoin the conversation\xe2\x80\xa6 https://t.co/AHHoXZTWT3'
961589986213625857,2018-02-08 13:18:12,b'RT @Najmmer: Her husband has also been Psychologically torturing her telling her she comes from a poor background and cannot survive withou\xe2\x80\xa6'
961587922137993218,2018-02-08 13:10:00,b'Why NASA MPs are not vetting cabinet nominees\nhttps://t.co/coRTYbmifh https://t.co/TclqvdmvwH'
961581629574705154,2018-02-08 12:45:00,b'JUST IN; Jimmy Wanjigi reacts to his \xe2\x80\x98death\xe2\x80\x99 announcement in Daily Nation\nhttps://t.co/DC0dNNaSwK https://t.co/w81Q5Kyfrs'
961574079558905856,2018-02-08 12:15:00,b'Tourism industry earnings grow to Sh120 billion in 2017\nhttps://t.co/vLofAijHwY https://t.co/4dbr3hNugp'
961570318207762432,2018-02-08 12:00:03,b'Six arrested in Kisii over hate speech\nhttps://t.co/oimjrBXvMG https://t.co/txBRj9mpSb'
961566530315091969,2018-02-08 11:45:00,b'Miguna Miguna outlines his plans \nhttps://t.co/JdkzF7ESRD https://t.co/8MdrJznjGH'
961562760567025664,2018-02-08 11:30:01,b'Miguna was put on an Amsterdam-bound flight for deportation to Canada\nhttps://t.co/bVOHZPJXYU https://t.co/NV4wgVdO4M'
961558980077215744,2018-02-08 11:15:00,b'Construction of Sh99m Nyamasaria road kicks off in Kisumu\nhttps://t.co/KUOQCCrsHg https://t.co/UAQBNE2R6C'
961555209146306560,2018-02-08 11:00:01,b'Smart Harvest Seaboard Corporation proposes to take-over Unga Group\nhttps://t.co/mRnUzVHLoC https://t.co/JN8Ga7VGFM'
961553006620823553,2018-02-08 10:51:16,b'Nine ways to know if she is a wife material\nhttps://t.co/c4yUFWGmEL via @UreportKe'
961551681904259072,2018-02-08 10:46:00,b'This is what KNH doctors have done\nhttps://t.co/OSQTo7BEsB https://t.co/rJV4u3kqZk'
961551430199988224,2018-02-08 10:45:00,b'Why you should be afraid while returning missed International phone calls \nhttps://t.co/bmW16nKzNf https://t.co/8YgIuJgPIN'
961547655506681856,2018-02-08 10:30:00,b'Kakamega man killed for stealing 4Kgs of maize\nhttps://t.co/YuNGuOBtDU https://t.co/OkfCLtmzIV'
961543880834338816,2018-02-08 10:15:00,b'Archbishop Anthony Muheria urges parties to follow law\nhttps://t.co/UbMlMA6SE4 https://t.co/64up1oKCKR'
961543048059645952,2018-02-08 10:11:41,b'How politics may come to \xe2\x80\x98haunt\xe2\x80\x99 CS nominee John Munyes\nhttps://t.co/KL4mnNAV9T https://t.co/epyRRgd1Dl'
961541961546158081,2018-02-08 10:07:22,"b""KNH doctors reattach teenager's hand that was stored in cool box for 10 hours\nhttps://t.co/nwUeFiruwE https://t.co/orjVqYYdvB"""
961540113011564544,2018-02-08 10:00:02,b'Youth in Muguna\xe2\x80\x99s village demonstrate over his deportation\nhttps://t.co/lmD5TXlDh4 https://t.co/NyxFGww2bh'
961538810483011584,2018-02-08 09:54:51,b'Watch how CS nominee John Munyes pleads with MPs to give him the job\nhttps://t.co/yQkddFUQmS https://t.co/OQjAeP5a63'
961536330780917760,2018-02-08 09:45:00,b'Unmasked: The man with an acidic tongue\nhttps://t.co/0x9dZYPx90 https://t.co/qZu0HYmr3z'
961534279825133569,2018-02-08 09:36:51,b'TOO FUNNY FOR LIFE: Kenyans\xe2\x80\x99 jaw-dropping answers when asked how they would spend Sh230 million\nhttps://t.co/JH0G7LSfHj via @UreportKe'
961532560043110400,2018-02-08 09:30:01,"b'Miguna free to return to Kenya, lawyers say \nhttps://t.co/Cn5EOwOJx2 https://t.co/CaozI5WBYU'"
961528781524496384,2018-02-08 09:15:00,b'City shoe shiners complain of harassment by askaris \nhttps://t.co/oVwCKLddDY https://t.co/MRtrbAeuQz'
961525016423796736,2018-02-08 09:00:02,b'Maraga: Choice to disobey court orders has consequences\nhttps://t.co/kA84c11Hmk https://t.co/alPK0WOzPV'
961521231597002752,2018-02-08 08:45:00,b'This is what NASA MPs have done today\nhttps://t.co/qizCue6oXu https://t.co/tW79saALAW'
961521231446118400,2018-02-08 08:45:00,b'Children recount trauma of abduction after mass release by South Sudan rebels \nhttps://t.co/Q1rsBiYqIP https://t.co/nYYyaaSjsV'
961520668306280448,2018-02-08 08:42:46,"b""Kipchumba Mukormen's remarks against CJ Maraga land him in trouble\nhttps://t.co/DBqZ22KQ3O via @UreportKe"""
961518044811026432,2018-02-08 08:32:20,b'RT @StandardKenya: Why MP Babu Owino has ignored police summons \nhttps://t.co/MTBRlGbt9Z https://t.co/szZqrHWAzm'
961517458707353600,2018-02-08 08:30:00,b'Imprisoning democracy allows Jubilee chance to slip in authoritarianism \nhttps://t.co/rZasWUZOl8 https://t.co/d1T2NkybBM'
961513681510109184,2018-02-08 08:15:00,b'Police arrest 29 Ethiopians in Nairobi\nhttps://t.co/0U2Suocb8q https://t.co/Q7YdeNmgvT'
961512659647680512,2018-02-08 08:10:56,b'Why MP Babu Owino has ignored police summons \nhttps://t.co/MTBRlGbt9Z https://t.co/szZqrHWAzm'
961509915167662080,2018-02-08 08:00:02,"b""CS nominee's upbeat as they face vetting \nhttps://t.co/Zf0rhvqvMI https://t.co/ho8oebm1aN"""
961506762418515968,2018-02-08 07:47:30,b'Kenyans in Canada welcome Miguna Miguna (Photos) \nhttps://t.co/dEYl1q4IKo https://t.co/V7Mgs42x7v'
961506065375465472,2018-02-08 07:44:44,b'CS nominee Prof. Kobia explains how she will address gender issues in public service\nhttps://t.co/1EiT8am5YT https://t.co/8Se0Q90ddu'
961502357266862080,2018-02-08 07:30:00,b'Respect for the rule of law is not optional \nhttps://t.co/Dyx1zcAP0B https://t.co/c1EYofmea3'
961498584041574401,2018-02-08 07:15:00,b'IG asked to explain why he should not be punished \nhttps://t.co/oRj9hzApbh https://t.co/Z1mRbyEfrV'
961497314664833026,2018-02-08 07:09:58,b'Eight crimes the government committed against me - Miguna Miguna\nhttps://t.co/bMnLZeA7Gr via @UreportKe'
961494808907874304,2018-02-08 07:00:00,"b""Here's an opportunity to showcase your value added product to potential buyers. Register here\xe2\x80\xa6 https://t.co/OPvFx8W0se"""
961494471748870144,2018-02-08 06:58:40,b'RT @StandardKenya: These CS nominees will be vetted by MPs today\nhttps://t.co/gMZlbspNwZ https://t.co/riVq6ySq6J'
961494389104181249,2018-02-08 06:58:20,b'RT @KTNKenya: These CS nominees will be vetted by MPs today\nhttps://t.co/KhAziTiGSD https://t.co/H3sPMz6FiR'
961491093136297984,2018-02-08 06:45:14,b'These CS nominees will be vetted by MPs today\nhttps://t.co/gMZlbspNwZ https://t.co/riVq6ySq6J'
961491032167755776,2018-02-08 06:45:00,b'Grand deportations in Kenya \nhttps://t.co/iACO2ngaB4 https://t.co/GPbaF6Yiwd'
961487761365757952,2018-02-08 06:32:00,"b""From rags to riches!\nSh230 million SportPesa Jackpot winner 'makes it rain' as he dishes out money...\xe2\x80\xa6 https://t.co/lT71JMFyd7"""
961485351918424065,2018-02-08 06:22:26,"b""Seven interesting things you didn't know about Miguna Miguna\nhttps://t.co/xkSM7PW7mM via @UreportKe"""
961483378791940096,2018-02-08 06:14:35,b'How Miguna Miguna was welcomed in Canada\nhttps://t.co/74rSuMSXCa https://t.co/oEfb3tA0Gy'
961479708478201857,2018-02-08 06:00:00,b'Why research puts Kenyan students fourth on list of top hackers in Africa \nhttps://t.co/jpv4yee2Mo https://t.co/DmGFfOSfEt'
961476989571031040,2018-02-08 05:49:12,b'OPINION: How Uhuru is preparing the way for Gideon Moi in 2022\nhttps://t.co/PZIdV9cOaT via @UreportKe'
961475932883009536,2018-02-08 05:45:00,b'Ruaraka MP TJ Kajwang pleads \xe2\x80\x98NOT GUILTY\xe2\x80\x99 to state charges over Raila \xe2\x80\x98swearing in\xe2\x80\x99\nhttps://t.co/KEJNv10gYw https://t.co/O2B3bbyGWH'
961473659591430144,2018-02-08 05:35:58,b'Securing Liberia: The UN troops set to leave Liberia as the country regains stability\n#KTNMorningExpress https://t.co/hYSeSLEJJ5'
961473416388780033,2018-02-08 05:35:00,b'Miguna: They must all pay for this\nhttps://t.co/JlQGG87cO8 https://t.co/F5j6uYvmrQ'
961472997092745216,2018-02-08 05:33:20,b'Nigeria Conflict: Over 100 killed since January due to inter-communal clashes \n#KTNMorningExpress https://t.co/RnhoKwW78Q'
961472987198312448,2018-02-08 05:33:18,"b""OPINION: Uhuru's silence on current events betrays his vision\nhttps://t.co/zVRwkEjBvL via @UreportKe"""
961471906502402048,2018-02-08 05:29:00,"b'\xe2\x80\x9cI lost my parents 20 years ago, I thank Wanyama for saving my bet in Liverpool vs Tottenham draw,\xe2\x80\x9d says SportPesa\xe2\x80\xa6 https://t.co/88LLpd7McX'"
961471605632204805,2018-02-08 05:27:48,b'What is your opinion on Leaders disobeying Court Orders? \n#KTNMorningExpress \n@michaelggitonga @KTNNews https://t.co/K1YjThb0wz'
961471324572082181,2018-02-08 05:26:41,b'Miguna vows to fight his deportation by all means\n#KTNMorningExpress https://t.co/Uuoe5Ag7Kp'
961470880965713920,2018-02-08 05:24:55,b'Coffee prodution has been on a downward trend and farmers have now shifted to Macadamia farming\n#KTNMorningExpress https://t.co/NYZiMmxSXL'
961470724820160513,2018-02-08 05:24:18,b'The International commission of Jurists has condemned the continued shutdown of Citizen TV\n#KTNMorningExpress https://t.co/pdAdzboEBM'
961470602996539393,2018-02-08 05:23:49,b'Kericho Roads blocked by PSV operators over stoning of cars in Kisumu\n#KTNMorningExpress https://t.co/uLSvNc5BMa'
961469693990236162,2018-02-08 05:20:12,b'The government suspends NASA leaders passports\n #KTNMorningExpress https://t.co/ATZMVtKn08'
961468383530283008,2018-02-08 05:15:00,b'Why competency is better than papers for Cabinet Secretaries \nhttps://t.co/0O33F8iW9W https://t.co/gUBGHPR5Et'
961465998258958336,2018-02-08 05:05:31,b'Miguna vows to fight his deportation by all means \n#KTNMorningExpress https://t.co/QfO0mHt4ie'
961465247243612160,2018-02-08 05:02:32,b'David Maraga issues statement about the court orders not being honored \n#KTNMorningExpress https://t.co/lKVuQTrfan'
961464886483177472,2018-02-08 05:01:06,b'Nairobi risks going the Cape Town way \nhttps://t.co/DqCkyZROIr https://t.co/0Ib3vHeUvo'
961464829096726528,2018-02-08 05:00:53,b'What is your opinion on Leaders disobeying Court Orders? \n#KTNMorningExpress \n@michaelggitonga @KTNNews https://t.co/GehjLchq4x'
961460833413820417,2018-02-08 04:45:00,"b'Miguna Miguna narrates, from Canada, his 5-day ordeal\nhttps://t.co/iFQvp0Odq9 https://t.co/BMT8eL6JSZ'"
961459574816628736,2018-02-08 04:40:00,b'Nominated Senator Millicent Omanga and Babu Owino rip each other apart on social media-via @UreportKe\xe2\x80\xa6 https://t.co/C0JH8Iswsk'
961456052255576066,2018-02-08 04:26:00,b'TROUBLE!\nManchester United star Alexis Sanchez sentenced for tax fraud\xe2\x80\xa6https://t.co/TMehSZA8jW via @GameYetu https://t.co/dzY73qAEzS'
961453283742281730,2018-02-08 04:15:00,"b'I will not kick Uhuru out of State House, Raila says as he calls for fresh polls \nhttps://t.co/0jRmbNPfwY https://t.co/13DzM1Y8hF'"
961449512538697728,2018-02-08 04:00:01,b'How will the next chapter of your agribusiness investment begin?  Join us by registering now\xe2\x80\xa6 https://t.co/bo3A0Ne6SL'
961445733873238016,2018-02-08 03:45:00,"b'Justice Kimaru orders to IG, CID, immigration bosses after Miguna\xe2\x80\x99s deportation\nhttps://t.co/YQTJeoFwHI https://t.co/dAuWo6onP0'"
961444475712176128,2018-02-08 03:40:00,b'Babu Owino sends his apology to Miguna Miguna after he was deported -via @UreportKe\nhttps://t.co/ch9wpQ1jqh https://t.co/RNDBbdmMMV'
961438184432287745,2018-02-08 03:15:00,b'Police asked to probe unusual death announcement as CCTV footage emerges \nhttps://t.co/MgQpCw05Qj https://t.co/dRYOezAWVG'
961430634450309120,2018-02-08 02:45:00,b'This is why CJ Maraga is an angry man\nhttps://t.co/Zevwte9kwv https://t.co/HFXhEQlk8h'
961429376918282240,2018-02-08 02:40:00,"b""DEPORTED OR EXILED? Priceless reactions from Kenyans after Miguna's sudden 'deportation'- via @UreportKe\xe2\x80\xa6 https://t.co/NMzfM2hHSB"""
961415534838501377,2018-02-08 01:45:00,b'David Ndii\xe2\x80\x99s combative reply to government suspending passports\n\\https://t.co/nwccWLTJkL https://t.co/AsauBOc7Bo'
961414277927026689,2018-02-08 01:40:00,b'Government confirms why it deported NRM General Miguna Miguna -via @UreportKe\nhttps://t.co/Kqz9snOSZU https://t.co/mtxD85XPf5'
961407985464553472,2018-02-08 01:15:00,"b'First Uber driver in Kenya, 10,300 trips later \nhttps://t.co/UTgJnFdD4h https://t.co/R1Xi9c8rBW'"
961400435079766016,2018-02-08 00:45:00,b'Embakasi East MP Babu Owino is on the spot\nhttps://t.co/QucctDJ905 https://t.co/LRsTujuYpm'
961392885819215873,2018-02-08 00:15:00,b'What it took to sell big brands on the unknown \nhttps://t.co/FdYf0pU8TO https://t.co/fi1hjiSkkc'
961377787557883909,2018-02-07 23:15:00,b'Man killed as police fire at Miguna supporters \nhttps://t.co/odogeKvgFQ https://t.co/lVae7so8aD'
961362687253929984,2018-02-07 22:15:00,b'Blow to e-commerce as OLX shuts its Kenya office \nhttps://t.co/UPcbuh4rim https://t.co/npPwzX6NOX'
961362687182753792,2018-02-07 22:15:00,"b'At least four killed, 60 missing after quake rocks Taiwan tourist area \nhttps://t.co/KfeI1oJ1rX https://t.co/JFZA5CswDb'"
961347587604340736,2018-02-07 21:15:00,b'Uhuru directive on meetings to hurt tourism: stakeholders say \nhttps://t.co/mhgFs8jCDS https://t.co/CrfFW1aFFL'
961346328688181248,2018-02-07 21:10:00,b'Senior counsel James Orengo speaks on Miguna\xe2\x80\x99s case\nhttps://t.co/tXlicbOoin https://t.co/zSI3vPUu8p'
961343824378376192,2018-02-07 21:00:03,b'Grab your copy of the Standard for the latest news updates. #GetTheWholeStory https://t.co/hVzhVDEXYu'
961341295858827265,2018-02-07 20:50:00,"b'#ShindaNaMbet \nsh1,197,938\nPlay and Win on PERFECT12 with @MBetKenya here \xf0\x9f\x91\x89 https://t.co/lpkt6Ry6Q2 https://t.co/0EcqxtJxHF'"
961341295800197120,2018-02-07 20:50:00,"b'#ShindaNaMbet \nsh1,197,938\nPlay and Win on PERFECT12 with @MBetKenya here \xf0\x9f\x91\x89 https://t.co/lpkt6Ry6Q2'"
961340037404258304,2018-02-07 20:45:00,b'Nation Media apologizes for Jimmy Wanjigi\xe2\x80\x99s \xe2\x80\x98death\xe2\x80\x99 announcement\nhttps://t.co/XdoqKFWbnu'
961338780664856576,2018-02-07 20:40:00,"b'\xe2\x80\x9cDear Uhuru Kenyatta, Tumetoka Mbali\xe2\x80\xa6\xe2\x80\x9d \xe2\x80\x93 Outspoken Lawyer pens letter to the President-via @UreportKe\xe2\x80\xa6 https://t.co/K9fPSz5LBB'"
961333081868308481,2018-02-07 20:17:22,b'RT @KTNNews: Prof. Israel Kodiaga: Majority of the governing political parties in Africa are still heavily dependent on the use or abuse of\xe2\x80\xa6'
961332489682907136,2018-02-07 20:15:00,b'Sh19m water project launched in Busia \nhttps://t.co/4H2KZIpli8 https://t.co/Z4m24WipU3'
961329971758354433,2018-02-07 20:05:00,"b""For the next two weeks (Friday's) @KenyaBankers\xe2\x80\x8b will host great discussions on various trends in the banking indus\xe2\x80\xa6 https://t.co/gOI0p0q3sk"""
961329341186695170,2018-02-07 20:02:30,"b'RT @KTNNews: Javas Bigambo: There is a self-evident lie, a perpetuated falsehood that democracy especially in Africa is the anathema of goo\xe2\x80\xa6'"
961329290519437314,2018-02-07 20:02:18,b'RT @KTNNews: Javas Bigambo: There is scarcely any other African country that practices democracy in the mould of the ANC whereby you find t\xe2\x80\xa6'
961329276384698368,2018-02-07 20:02:14,b'He is coming back!\nFormer Manchester United star Patrice Evra set to for Premier League return\xe2\x80\xa6\xe2\x80\xa6 https://t.co/NTLzOmbCKA'
961328718554726400,2018-02-07 20:00:01,"b""End-game looms for South Africa's Zuma \nhttps://t.co/u6jCaUfHuO https://t.co/afIEoslyaF"""
961324940103487490,2018-02-07 19:45:00,b'Angry CJ Maraga warns government \nhttps://t.co/aFmH2m4Q1k https://t.co/sMEXk751mE'
961324938899603457,2018-02-07 19:45:00,b'UN says hundreds of child soldiers freed in South Sudan \nhttps://t.co/f3DEDYUGT8 https://t.co/SIPmQyX5uH'
961324937767133184,2018-02-07 19:45:00,"b'#CEOChat Join Samuel Kimani, CEO- @JamiiBoraBank on Friday (9th Feb, 2018) for an insightful LIVE chat from 10am to\xe2\x80\xa6 https://t.co/gHHy6Nzi9N'"
961324656736264192,2018-02-07 19:43:53,b'RT @KTNNews: Dr Alex Awiti: What we are seeing in South Africa where the ANC has asked its very own pres. Zuma to step down is a culture of\xe2\x80\xa6'
961323680000196608,2018-02-07 19:40:00,b'Miguna Miguna speaks for the first time since his deportation -via @UreportKe  https://t.co/Co8L70khDZ https://t.co/GGhLvEELnb'
961320770008907776,2018-02-07 19:28:26,"b""RT @KTNNews: At a detention center in Israel's Negev dessert, African migrants face deportation. Israel is working to expel thousands of Er\xe2\x80\xa6"""
961318887211044864,2018-02-07 19:20:57,b'RT @KTNNews: The last of police and military officers serving under the UN mission in Liberia left Liberia after an official farewell cerem\xe2\x80\xa6'
961318409253326849,2018-02-07 19:19:03,b'RT @KTNNews: Hundreds of pro-government demonstrators in South Sudan marched in its capital Juba on Tuesday protesting against a US arms re\xe2\x80\xa6'
961317388955262976,2018-02-07 19:15:00,b'Government Gazettes Lake Ol Bolossat as wetlands protected area \nhttps://t.co/6X74aWMKLa https://t.co/BHkhZqWS2G'
961313631668498432,2018-02-07 19:00:04,b'With the right resources and mentorship you can transform your idea into a viable agribusiness.  Register now\xe2\x80\xa6 https://t.co/MjT3g6IMQ7'
961313630666010625,2018-02-07 19:00:04,b'With the right resources and mentorship you can transform your idea into a viable agribusiness.  Register now\xe2\x80\xa6 https://t.co/lrDTOStXFe'
961312358902714368,2018-02-07 18:55:01,b'Thank you for watching #KTNPrime  with @Ben_Kitili stay tuned for #BottomlineAfrica with @YussufIbra coming up next\xe2\x80\xa6 https://t.co/0TKMOQJyyE'
961312354838331393,2018-02-07 18:55:00,"b""#ShindaNaMbet Both teams come into this match at defining moments of their season. What's your prediction on tonigh\xe2\x80\xa6 https://t.co/tGoVX5yprD"""
961311830340710400,2018-02-07 18:52:55,"b""RT @KTNNews: Kenya's Capital markets remain resilient though vulnerable to emerging shocks, according to the latest Capital Markets Soundne\xe2\x80\xa6"""
961311084874534912,2018-02-07 18:49:57,b'RT @KTNNews: The 11th Annual Forum of Developing Countries Investment Negotiators officially kicked off today in Nairobi. The three day del\xe2\x80\xa6'
961309838784565249,2018-02-07 18:45:00,b'Magic happens when you break with tradition \nhttps://t.co/ap6c939sRt https://t.co/2dZDJp23VD'
